{"authority":"MANAGEMENT_WORKLOAD_MANIFEST_IMAGE_RESOLUTION_V1","schemaVersion":1,"sourceManifestSha256":"sha256:41648963af867ac1d0c85755fb53cf61cacd57c9bb22e1942e3fb0439eeb04fd","sourceManifestBytes":207054,"resolvedManifestSha256":"sha256:d2dde83e7cdd9877b4bd616833f59beb894a624fc6ec0ab51174155bd308f751","resolvedManifestBytes":207822,"images":[{"source":"docker.io/longhornio/backing-image-manager:v1.12.1","exact":"docker.io/longhornio/backing-image-manager@sha256:a61eb7d0b58d477c4fc6a68ef718be477a070f9514aaf6e3cc78eb887492577f"},{"source":"docker.io/longhornio/longhorn-engine:v1.12.1","exact":"docker.io/longhornio/longhorn-engine@sha256:7f7513ab2c8e6da56f0b26b17d20caaf2ff9725fbf09373ee651348eb3076561"},{"source":"docker.io/longhornio/longhorn-instance-manager:v1.12.1","exact":"docker.io/longhornio/longhorn-instance-manager@sha256:fba5787b2928a686f733afe7131aa52cf5a0e1bd8664a1653ec69e12167a6592"},{"source":"docker.io/longhornio/longhorn-manager:v1.12.1","exact":"docker.io/longhornio/longhorn-manager@sha256:588749e808e27c2d984bec810dd6e9d93e8842ee488715cb43433dd840a94c00"},{"source":"docker.io/longhornio/longhorn-share-manager:v1.12.1","exact":"docker.io/longhornio/longhorn-share-manager@sha256:0d17310563f501257554dcf294f2b53b855fb6432ec5ec921dd280662e9b448d"},{"source":"docker.io/longhornio/longhorn-ui:v1.12.1","exact":"docker.io/longhornio/longhorn-ui@sha256:961d7096b17f532176454482ac8bec090e31d9eb69078f5bb091e568f48e4342"},{"source":"docker.io/longhornio/support-bundle-kit:v0.0.92","exact":"docker.io/longhornio/support-bundle-kit@sha256:11ec18455e795d44bef63367e759e734b118b772b8bedea4f0c92b3ec64c1e2f"}]}
