{"authority":"MANAGEMENT_WORKLOAD_MANIFEST_IMAGE_RESOLUTION_V1","schemaVersion":1,"sourceManifestSha256":"sha256:65d9d4ff520ddb40bad2c39b1f44188ceecfe96b5dd29c8ead569b52d6c6b8c6","sourceManifestBytes":1969264,"resolvedManifestSha256":"sha256:06f54ea39afc8dfca1e4bf1332ca8494fd8a1c15820d690f716bcef182618af9","resolvedManifestBytes":1970202,"images":[{"source":"ghcr.io/dexidp/dex:v2.45.0","exact":"ghcr.io/dexidp/dex@sha256:b8469881d3cb3a73001506f0d3aaefecb9c45d2311c1e0f405d8ac538316c59d"},{"source":"public.ecr.aws/docker/library/haproxy:3.0.8-alpine","exact":"public.ecr.aws/docker/library/haproxy@sha256:e11f034e651603f10a365e5ad5a0321825e18eded9620e40c4f4d6ae58419bfe"},{"source":"public.ecr.aws/docker/library/redis:8.2.3-alpine","exact":"public.ecr.aws/docker/library/redis@sha256:08ad0b1d280850169a790dba1393ff7a90aef951fc19632cf4d3ce4f78e679ba"},{"source":"quay.io/argoproj/argocd:v3.5.0","exact":"quay.io/argoproj/argocd@sha256:c298cedbaeb31532ba8d4e9904eba9e4987e067293fbd86400c5194e78f743d5"}]}
