{"authority":"MANAGEMENT_WORKLOAD_MANIFEST_IMAGE_RESOLUTION_V1","schemaVersion":1,"sourceManifestSha256":"sha256:f8bede43fe4ee0d478c2355b204a36876b2ae4faac60f2a9452280b293da3b88","sourceManifestBytes":1262410,"resolvedManifestSha256":"sha256:e42982f9631e3226d2cbb5372f71e04deacccfd940c62102a3fa8e1647d1699c","resolvedManifestBytes":1262475,"images":[{"source":"ghcr.io/cloudnative-pg/cloudnative-pg:1.30.0","exact":"ghcr.io/cloudnative-pg/cloudnative-pg@sha256:091d306935cfdf646debfe78010d59ebfb572150eb6eb922b0203873c0c68841"}]}
