{"authority":"MANAGEMENT_WORKLOAD_MANIFEST_IMAGE_RESOLUTION_V1","schemaVersion":1,"sourceManifestSha256":"sha256:a32bf36a437071a1f563ebf9e81c8a39fba9057c17db7d5d041afb7b6e3f4afe","sourceManifestBytes":1917766,"resolvedManifestSha256":"sha256:81a846d1e9f15871585084a4637bb4648f807afbff6aed9093c1ee213e60626c","resolvedManifestBytes":1918409,"images":[{"source":"ghcr.io/dexidp/dex:v2.45.0","exact":"ghcr.io/dexidp/dex@sha256:b8469881d3cb3a73001506f0d3aaefecb9c45d2311c1e0f405d8ac538316c59d"},{"source":"public.ecr.aws/docker/library/redis:8.2.3-alpine","exact":"public.ecr.aws/docker/library/redis@sha256:08ad0b1d280850169a790dba1393ff7a90aef951fc19632cf4d3ce4f78e679ba"},{"source":"quay.io/argoproj/argocd:v3.5.0","exact":"quay.io/argoproj/argocd@sha256:c298cedbaeb31532ba8d4e9904eba9e4987e067293fbd86400c5194e78f743d5"}]}
